Nome da Publicação,Temática,Tipo de material,Tópicos / Assuntos,Órgão/Instituição,Idioma,Arquivo,Link p/ acesso
Orientações de Acesso aos serviços de saúde em Curitiba,Geral,Cartaz,"Sintomas,Se estiver infectado,Situação vacinal,Telefones úteis (Curitiba),Teleconsultas,Orientações gerais",UFPR / SUS,Português,Acesso à saúde Curitiba-Portugues.pdf (https://dl.airtable.com/.attachments/666f21afb514ee42e6e8e1c0f18b25b4/5c6be0cd/AcessosadeCuritiba-Portugues.pdf),
Novo Coronavirus - A SAÚDE NO SUS É DIREITO DE TODOS,Geral,Cartilha,"O que é COVID-19 (Corona vírus),Sintomas,Direito à saúde do solicitante de refúgio,Saúde pública gratuita",ACNUR / SUS / Governo do Rio de Janeiro,Português,Orientacoes GRJ POR-para-imigrantes-e-refugiados-coronavirus.pdf (https://dl.airtable.com/.attachments/e2e1f5158b852a9b181dc4083d8c8f96/a8704c86/OrientacoesGRJPOR-para-imigrantes-e-refugiados-coronavirus.pdf),
Orientações aos Povos Indígenas:  Coronavírus & Auxílio Emergencial,Geral,Cartilha,"O que é COVID-19 (Corona vírus),Isolamento Social,Sintomas,Soberania e Segurança Alimentar,Grupo de Risco,Auxílio Emergencial,Prevenção",APIB (Articulação dos Povos Indígenas do Brasil),Português,APIB_Orientações.pdf (https://dl.airtable.com/.attachments/65c3caeb49c2a5c2ac17c9ae411e1ab5/ea59257b/APIB_Orientaes.pdf),
,,,,,,,
,,,,,,,